[
  {"id":"kodachi_ruins","name":"Kodachi das Ruínas","description":"Lâmina curta recuperada de um túmulo do clã. Ainda corta.","type":"weapon","slot":"weapon","rarity":"uncommon","weight":4,"stack_max":1,"buy_price":6200,"sell_price":2480,"attack":40,"weapon_class":"melee","skill":"taijutsu","required_level":28,"sprite":"item_kodachi"},
  {"id":"puppet_blade","name":"Lâmina de Marionete","description":"Braço-lâmina arrancado de uma marionete de guerra.","type":"weapon","slot":"weapon","rarity":"rare","weight":6,"stack_max":1,"buy_price":9800,"sell_price":3920,"attack":52,"weapon_class":"melee","skill":"taijutsu","required_level":35,"bonuses":{"crit_chance":0.04,"skill_taijutsu":3},"sprite":"item_puppet_blade"},
  {"id":"chain_kunai","name":"Kunai com Corrente","description":"Kunai presa a uma corrente: arremessa e volta.","type":"weapon","slot":"weapon","rarity":"uncommon","weight":3,"stack_max":1,"buy_price":7200,"sell_price":2880,"attack":42,"weapon_class":"ranged","weapon_range":5,"skill":"shuriken","required_level":30,"bonuses":{"skill_shuriken":2},"sprite":"item_chain_kunai"},

  {"id":"mask_clan_ruins","name":"Máscara do Clã Perdido","description":"Máscara ritual de um clã que ninguém mais nomeia.","type":"armor","slot":"head","rarity":"uncommon","weight":1.5,"buy_price":2900,"sell_price":1160,"defense":8,"required_level":30,"bonuses":{"skill_genjutsu":2},"sprite":"item_mask_clan"},
  {"id":"robe_clan_ruins","name":"Manto do Clã Perdido","description":"Tecido pesado bordado com selos desbotados.","type":"armor","slot":"body","rarity":"rare","weight":7,"buy_price":7200,"sell_price":2880,"defense":17,"required_level":30,"bonuses":{"hp":60,"element_resist_doton":0.15},"sprite":"item_robe_clan"},
  {"id":"greaves_clan_ruins","name":"Grevas do Clã Perdido","description":"Placas de pedra polida sobre couro.","type":"armor","slot":"legs","rarity":"uncommon","weight":4,"buy_price":4300,"sell_price":1720,"defense":11,"required_level":30,"bonuses":{"hp":25},"sprite":"item_greaves_clan"},
  {"id":"boots_clan_ruins","name":"Botas do Clã Perdido","description":"Silenciosas nas lajes soltas das ruínas.","type":"armor","slot":"feet","rarity":"uncommon","weight":2,"buy_price":2200,"sell_price":880,"defense":6,"required_level":30,"bonuses":{"speed":0.4},"sprite":"item_boots_clan"},

  {"id":"amulet_clan_seal","name":"Amuleto do Selo Antigo","description":"O selo ainda puxa chakra do ambiente.","type":"accessory","slot":"accessory","rarity":"rare","weight":0.2,"buy_price":6000,"sell_price":2400,"bonuses":{"chakra":80,"regen_chakra":3,"skill_ninjutsu":3},"required_level":30,"sprite":"item_amulet_seal"},
  {"id":"ring_stone_will","name":"Anel da Vontade de Pedra","description":"Pesa mais do que deveria. Quem o usa também.","type":"accessory","slot":"accessory","rarity":"rare","weight":0.2,"buy_price":6500,"sell_price":2600,"bonuses":{"hp":70,"skill_defense":4,"defense":3},"required_level":32,"sprite":"item_ring_stone"},

  {"id":"scroll_katon_anel_chamas","name":"Pergaminho: Anel de Chamas","description":"Ensina Katon: Anel de Chamas.","type":"scroll","rarity":"rare","weight":0.5,"buy_price":6000,"sell_price":0,"teaches_jutsu":"katon_anel_chamas","required_level":20,"required_village":"leaf","sprite":"item_scroll"},
  {"id":"scroll_suiton_prisao_agua","name":"Pergaminho: Prisão de Água","description":"Ensina Suiton: Prisão de Água.","type":"scroll","rarity":"rare","weight":0.5,"buy_price":8000,"sell_price":0,"teaches_jutsu":"suiton_prisao_agua","required_level":22,"required_village":"mist","sprite":"item_scroll"},
  {"id":"scroll_doton_estacas_terra","name":"Pergaminho: Estacas de Terra","description":"Ensina Doton: Estacas de Terra.","type":"scroll","rarity":"rare","weight":0.5,"buy_price":8000,"sell_price":0,"teaches_jutsu":"doton_estacas_terra","required_level":22,"required_village":"sand","sprite":"item_scroll"},

  {"id":"puppet_joint","name":"Junta de Marionete","description":"Madeira tratada e engrenagem. Material.","type":"material","rarity":"common","weight":0.8,"stack_max":100,"buy_price":0,"sell_price":120,"sprite":"item_puppet_joint"},
  {"id":"granite_core","name":"Núcleo de Granito","description":"O que faz uma sentinela andar. Material.","type":"material","rarity":"uncommon","weight":2,"stack_max":100,"buy_price":0,"sell_price":150,"sprite":"item_granite_core"},
  {"id":"spectral_ash","name":"Cinza Espectral","description":"Fria ao toque. Material alquímico.","type":"material","rarity":"uncommon","weight":0.2,"stack_max":100,"buy_price":0,"sell_price":180,"sprite":"item_spectral_ash"},
  {"id":"cursed_talisman","name":"Talismã Amaldiçoado","description":"Ninguém sabe o que ele selava. Material raro.","type":"material","rarity":"rare","weight":0.3,"stack_max":100,"buy_price":0,"sell_price":220,"sprite":"item_cursed_talisman"},

  {"id":"health_potion_medium","name":"Poção de Vida Média","description":"Recupera 300 HP.","type":"consumable","rarity":"uncommon","weight":0.3,"stack_max":100,"buy_price":200,"sell_price":40,"effect":{"type":"heal_hp","value":300},"required_level":25,"sprite":"item_potion_red2"},
  {"id":"chakra_pill_large","name":"Pílula de Chakra Grande","description":"Recupera 350 de chakra.","type":"consumable","rarity":"uncommon","weight":0.15,"stack_max":100,"buy_price":250,"sell_price":50,"effect":{"type":"heal_chakra","value":350},"required_level":30,"sprite":"item_pill_blue3"},

  {"id":"strings_of_the_puppeteer","name":"Fios do Marionetista","description":"Loot exclusivo do Marionetista das Ruínas. Os fios obedecem sozinhos.","type":"accessory","slot":"accessory","rarity":"epic","weight":0.3,"buy_price":0,"sell_price":18000,"bonuses":{"attack":8,"crit_chance":0.06,"skill_taijutsu":5,"speed":0.3},"required_level":45,"sprite":"item_strings"}
]
