[
  {
    "id": "ryo",
    "name": "Ryo",
    "description": "Moeda.",
    "type": "currency",
    "rarity": "common",
    "weight": 0,
    "stack_max": 1000000,
    "buy_price": 0,
    "sell_price": 0,
    "sprite": "item_ryo"
  },
  {
    "id": "wolf_pelt",
    "name": "Pele de Lobo",
    "description": "Material. Vendável.",
    "type": "material",
    "rarity": "common",
    "weight": 1,
    "stack_max": 100,
    "buy_price": 0,
    "sell_price": 15,
    "sprite": "item_pelt"
  },
  {
    "id": "snake_fang",
    "name": "Presa de Cobra",
    "description": "Material para venenos.",
    "type": "material",
    "rarity": "uncommon",
    "weight": 0.1,
    "stack_max": 100,
    "buy_price": 0,
    "sell_price": 40,
    "sprite": "item_fang"
  },
  {
    "id": "bandit_emblem",
    "name": "Emblema de Bandido",
    "description": "Prova de caça. Missões pedem isso.",
    "type": "material",
    "rarity": "common",
    "weight": 0.1,
    "stack_max": 100,
    "buy_price": 0,
    "sell_price": 8,
    "sprite": "item_emblem"
  },
  {
    "id": "scroll_katon_housenka",
    "name": "Pergaminho: Flores de Fênix",
    "description": "Ensina Katon: Housenka.",
    "type": "scroll",
    "rarity": "uncommon",
    "weight": 0.5,
    "buy_price": 5000,
    "sell_price": 0,
    "teaches_jutsu": "katon_housenka",
    "required_level": 12,
    "required_village": "leaf",
    "sprite": "item_scroll"
  },
  {
    "id": "scroll_shousen",
    "name": "Pergaminho: Palma Curativa",
    "description": "Ensina Shousen.",
    "type": "scroll",
    "rarity": "uncommon",
    "weight": 0.5,
    "buy_price": 3000,
    "sell_price": 0,
    "teaches_jutsu": "shousen",
    "required_level": 10,
    "sprite": "item_scroll"
  },
  {
    "id": "ring_chakra",
    "name": "Anel de Chakra",
    "description": "Regen de chakra +2.",
    "type": "accessory",
    "slot": "accessory",
    "rarity": "rare",
    "weight": 0.1,
    "buy_price": 0,
    "sell_price": 3000,
    "bonuses": {
      "regen_chakra": 2,
      "chakra": 40
    },
    "required_level": 18,
    "sprite": "item_ring"
  },
  {
    "id": "leech_gland",
    "name": "Glândula de Sanguessuga",
    "description": "Material alquímico.",
    "type": "material",
    "rarity": "common",
    "weight": 0.2,
    "stack_max": 100,
    "buy_price": 0,
    "sell_price": 35,
    "sprite": "item_gland"
  },
  {
    "id": "toad_skin",
    "name": "Pele de Sapo",
    "description": "Couro impermeável.",
    "type": "material",
    "rarity": "common",
    "weight": 1.5,
    "stack_max": 100,
    "buy_price": 0,
    "sell_price": 60,
    "sprite": "item_toad_skin"
  },
  {
    "id": "toad_oil",
    "name": "Óleo de Sapo",
    "description": "Raro. Usado em pergaminhos de Suiton.",
    "type": "material",
    "rarity": "uncommon",
    "weight": 0.3,
    "stack_max": 100,
    "buy_price": 0,
    "sell_price": 150,
    "sprite": "item_oil"
  },
  {
    "id": "rogue_headband",
    "name": "Bandana Riscada",
    "description": "Bandana de um desertor. Prova de caça.",
    "type": "material",
    "rarity": "common",
    "weight": 0.3,
    "stack_max": 100,
    "buy_price": 0,
    "sell_price": 45,
    "sprite": "item_headband_x"
  },
  {
    "id": "scroll_suiton_suiryuudan",
    "name": "Pergaminho: Dragão de Água",
    "description": "Ensina Suiton: Suiryuudan.",
    "type": "scroll",
    "rarity": "rare",
    "weight": 0.5,
    "buy_price": 15000,
    "sell_price": 0,
    "teaches_jutsu": "suiton_suiryuudan",
    "required_level": 25,
    "required_village": "mist",
    "sprite": "item_scroll"
  },
  {
    "id": "scroll_raiton_punho_trovao",
    "name": "Pergaminho: Punho do Trovão",
    "description": "Ensina Raiton: Punho do Trovão.",
    "type": "scroll",
    "rarity": "rare",
    "weight": 0.5,
    "buy_price": 20000,
    "sell_price": 0,
    "teaches_jutsu": "raiton_punho_trovao",
    "required_level": 30,
    "sprite": "item_scroll",
    "required_village": "cloud"
  },
  {
    "id": "scroll_katon_karyuu",
    "name": "Pergaminho: Dragão de Fogo",
    "description": "Ensina Katon: Karyuu Endan.",
    "type": "scroll",
    "rarity": "rare",
    "weight": 0.5,
    "buy_price": 25000,
    "sell_price": 0,
    "teaches_jutsu": "katon_karyuu_endan",
    "required_level": 35,
    "required_village": "leaf",
    "sprite": "item_scroll"
  },
  {
    "id": "scroll_kawarimi",
    "name": "Pergaminho: Kawarimi",
    "description": "Ensina Kawarimi (se ainda não souber).",
    "type": "scroll",
    "rarity": "uncommon",
    "weight": 0.5,
    "buy_price": 800,
    "sell_price": 0,
    "teaches_jutsu": "kawarimi",
    "required_level": 5,
    "sprite": "item_scroll"
  },
  {
    "id": "scroll_bunshin",
    "name": "Pergaminho: Bunshin",
    "description": "Ensina Bunshin.",
    "type": "scroll",
    "rarity": "uncommon",
    "weight": 0.5,
    "buy_price": 1200,
    "sell_price": 0,
    "teaches_jutsu": "bunshin",
    "required_level": 8,
    "sprite": "item_scroll"
  },
  {
    "id": "backpack_leather",
    "name": "Mochila de Couro",
    "description": "+8 slots... em breve. Por enquanto +30 de capacidade.",
    "type": "accessory",
    "slot": "back",
    "rarity": "uncommon",
    "weight": 1,
    "buy_price": 900,
    "sell_price": 360,
    "bonuses": {
      "capacity": 30
    },
    "required_level": 5,
    "sprite": "item_backpack"
  },
  {
    "id": "scroll_fuuton_rajada_cortante",
    "name": "Pergaminho: Rajada Cortante",
    "description": "Ensina Fuuton: Rajada Cortante.",
    "type": "scroll",
    "rarity": "uncommon",
    "weight": 0.5,
    "buy_price": 5000,
    "sell_price": 0,
    "teaches_jutsu": "fuuton_rajada_cortante",
    "required_level": 16,
    "required_village": "sand",
    "sprite": "item_scroll"
  },
  {
    "id": "scroll_raiton_lanca_relampago",
    "name": "Pergaminho: Lança do Relâmpago",
    "description": "Ensina Raiton: Lança do Relâmpago.",
    "type": "scroll",
    "rarity": "uncommon",
    "weight": 0.5,
    "buy_price": 6000,
    "sell_price": 0,
    "teaches_jutsu": "raiton_lanca_relampago",
    "required_level": 18,
    "required_village": "cloud",
    "sprite": "item_scroll"
  },
  {
    "id": "scroll_raiton_armadura_eletrica",
    "name": "Pergaminho: Armadura Elétrica",
    "description": "Ensina Raiton: Armadura Elétrica.",
    "type": "scroll",
    "rarity": "rare",
    "weight": 0.5,
    "buy_price": 9000,
    "sell_price": 0,
    "teaches_jutsu": "raiton_armadura_eletrica",
    "required_level": 24,
    "required_village": "cloud",
    "sprite": "item_scroll"
  },
  {
    "id": "scroll_katon_sopro_brasas",
    "name": "Pergaminho: Sopro de Brasas",
    "description": "Ensina Katon: Sopro de Brasas (se ainda não souber).",
    "type": "scroll",
    "rarity": "common",
    "weight": 0.5,
    "buy_price": 500,
    "sell_price": 0,
    "teaches_jutsu": "katon_sopro_brasas",
    "required_level": 6,
    "required_village": "leaf",
    "sprite": "item_scroll"
  }
]
