[
  {"id":"kunai_iron","name":"Kunai de Ferro","description":"Arma básica de todo genin.","type":"weapon","slot":"weapon","rarity":"common","weight":1.5,"stack_max":1,"buy_price":50,"sell_price":20,"attack":8,"weapon_class":"melee","skill":"taijutsu","required_level":1,"sprite":"item_kunai"},
  {"id":"tanto_steel","name":"Tantō de Aço","description":"Lâmina curta e rápida.","type":"weapon","slot":"weapon","rarity":"common","weight":3,"stack_max":1,"buy_price":400,"sell_price":160,"attack":16,"weapon_class":"melee","skill":"taijutsu","required_level":8,"sprite":"item_tanto"},
  {"id":"katana_ronin","name":"Katana do Ronin","description":"Encontrada em ninjas renegados.","type":"weapon","slot":"weapon","rarity":"uncommon","weight":5,"stack_max":1,"buy_price":2500,"sell_price":1000,"attack":28,"weapon_class":"melee","skill":"taijutsu","required_level":20,"bonuses":{"crit_chance":0.03},"sprite":"item_katana"},
  {"id":"shuriken_iron","name":"Shuriken de Ferro","description":"Estrela de arremesso. Alcance 4.","type":"weapon","slot":"weapon","rarity":"common","weight":0.2,"stack_max":100,"buy_price":5,"sell_price":1,"attack":6,"weapon_class":"ranged","weapon_range":4,"skill":"shuriken","required_level":1,"sprite":"item_shuriken"},
  {"id":"fuuma_shuriken","name":"Fūma Shuriken","description":"Shuriken gigante, retorna à mão.","type":"weapon","slot":"weapon","rarity":"rare","weight":4,"stack_max":1,"buy_price":6000,"sell_price":2400,"attack":30,"weapon_class":"ranged","weapon_range":5,"skill":"shuriken","required_level":25,"sprite":"item_fuuma"},
  {"id":"gloves_taijutsu","name":"Luvas de Combate","description":"Para quem prefere os punhos.","type":"weapon","slot":"weapon","rarity":"uncommon","weight":1,"stack_max":1,"buy_price":1200,"sell_price":480,"attack":14,"weapon_class":"melee","skill":"taijutsu","required_level":10,"bonuses":{"skill_taijutsu":3,"speed":0.5},"sprite":"item_gloves"}
]
