[
  {"id":"thunder_katana","name":"Katana do Trovão","description":"A lâmina estala sozinha antes da tempestade.","type":"weapon","slot":"weapon","rarity":"rare","weight":6,"stack_max":1,"buy_price":24200,"sell_price":9680,"attack":74,"weapon_class":"melee","skill":"taijutsu","required_level":55,"bonuses":{"crit_chance":0.05,"element_damage_raiton":0.15},"sprite":"item_thunder_katana"},
  {"id":"oni_kanabo","name":"Kanabō de Oni","description":"Clava cravejada, pesada demais para quem não treinou.","type":"weapon","slot":"weapon","rarity":"epic","weight":14,"stack_max":1,"buy_price":39200,"sell_price":15680,"attack":96,"weapon_class":"melee","skill":"taijutsu","required_level":70,"bonuses":{"skill_taijutsu":6,"hp":80,"speed":-0.3},"sprite":"item_kanabo"},
  {"id":"windblade_shuriken","name":"Shuriken Lâmina de Vento","description":"Gira cortando o próprio ar; volta pela mesma trilha.","type":"weapon","slot":"weapon","rarity":"rare","weight":5,"stack_max":1,"buy_price":28800,"sell_price":11520,"attack":78,"weapon_class":"ranged","weapon_range":6,"skill":"shuriken","required_level":60,"bonuses":{"skill_shuriken":5},"sprite":"item_windblade"},

  {"id":"helm_stormcaller","name":"Elmo do Bramido","description":"Feito na forja da montanha, temperado em raio.","type":"armor","slot":"head","rarity":"rare","weight":3,"buy_price":11500,"sell_price":4600,"defense":15,"required_level":60,"bonuses":{"hp":40,"element_resist_raiton":0.15},"sprite":"item_helm_storm"},
  {"id":"mail_stormcaller","name":"Cota do Bramido","description":"Escamas metálicas que dispersam a descarga.","type":"armor","slot":"body","rarity":"epic","weight":11,"buy_price":28800,"sell_price":11520,"defense":33,"required_level":60,"bonuses":{"hp":150,"element_resist_raiton":0.2,"skill_defense":4},"sprite":"item_mail_storm"},
  {"id":"greaves_stormcaller","name":"Grevas do Bramido","description":"Placas articuladas para escalar sob tempestade.","type":"armor","slot":"legs","rarity":"rare","weight":6,"buy_price":17300,"sell_price":6920,"defense":21,"required_level":60,"bonuses":{"hp":60},"sprite":"item_greaves_storm"},
  {"id":"boots_stormcaller","name":"Botas do Bramido","description":"Sola isolante. A montanha não avisa quando descarrega.","type":"armor","slot":"feet","rarity":"rare","weight":3,"buy_price":8600,"sell_price":3440,"defense":12,"required_level":60,"bonuses":{"speed":0.6,"element_resist_raiton":0.1},"sprite":"item_boots_storm"},

  {"id":"necklace_storm_fang","name":"Colar Presa da Tempestade","description":"Uma presa de oni riscada por raios.","type":"accessory","slot":"accessory","rarity":"epic","weight":0.3,"buy_price":24000,"sell_price":9600,"bonuses":{"skill_ninjutsu":8,"chakra":150,"element_damage_raiton":0.2},"required_level":60,"sprite":"item_storm_fang"},
  {"id":"ring_ancestral","name":"Anel Ancestral","description":"Passou por muitas mãos. Todas caíram na montanha.","type":"accessory","slot":"accessory","rarity":"epic","weight":0.2,"buy_price":27000,"sell_price":10800,"bonuses":{"hp":180,"crit_chance":0.07,"regen_hp":3},"required_level":65,"sprite":"item_ring_ancestral"},

  {"id":"scroll_suiton_vortice","name":"Pergaminho: Vórtice Devorador","description":"Ensina Suiton: Vórtice Devorador.","type":"scroll","rarity":"epic","weight":0.5,"buy_price":40000,"sell_price":0,"teaches_jutsu":"suiton_vortice_devorador","required_level":45,"required_village":"mist","sprite":"item_scroll"},
  {"id":"scroll_doton_colapso","name":"Pergaminho: Colapso do Terreno","description":"Ensina Doton: Colapso do Terreno.","type":"scroll","rarity":"epic","weight":0.5,"buy_price":45000,"sell_price":0,"teaches_jutsu":"doton_colapso_terreno","required_level":48,"required_village":"sand","sprite":"item_scroll"},
  {"id":"scroll_fuuin_contencao","name":"Pergaminho: Selo de Contenção","description":"Ensina Fuuin: Selo de Contenção. Qualquer vila pode aprender.","type":"scroll","rarity":"epic","weight":0.5,"buy_price":35000,"sell_price":0,"teaches_jutsu":"fuuin_contencao","required_level":40,"sprite":"item_scroll"},

  {"id":"thunder_feather","name":"Pena do Trovão","description":"Continua eriçada horas depois. Material.","type":"material","rarity":"uncommon","weight":0.2,"stack_max":100,"buy_price":0,"sell_price":280,"sprite":"item_thunder_feather"},
  {"id":"glacier_shard","name":"Estilhaço de Geleira","description":"Não derrete. Material.","type":"material","rarity":"rare","weight":1,"stack_max":100,"buy_price":0,"sell_price":320,"sprite":"item_glacier_shard"},
  {"id":"oni_horn","name":"Chifre de Oni","description":"Prova de caça grande. Material raro.","type":"material","rarity":"rare","weight":3,"stack_max":100,"buy_price":0,"sell_price":380,"sprite":"item_oni_horn"},
  {"id":"magma_scale","name":"Escama de Magma","description":"Quente ao toque mesmo dias depois. Material raro.","type":"material","rarity":"rare","weight":0.6,"stack_max":100,"buy_price":0,"sell_price":420,"sprite":"item_magma_scale"},

  {"id":"health_potion_large","name":"Poção de Vida Grande","description":"Recupera 700 HP.","type":"consumable","rarity":"rare","weight":0.4,"stack_max":100,"buy_price":800,"sell_price":160,"effect":{"type":"heal_hp","value":700},"required_level":50,"sprite":"item_potion_red3"},
  {"id":"soldier_pill","name":"Pílula do Soldado","description":"Recupera 500 de HP e de chakra. Amarga como derrota.","type":"consumable","rarity":"rare","weight":0.2,"stack_max":100,"buy_price":900,"sell_price":180,"effect":{"type":"heal_both","value":500},"required_level":55,"sprite":"item_soldier_pill"},

  {"id":"oni_fang_blade","name":"Lâmina Presa de Oni","description":"Loot exclusivo do Oni Ancestral. Talhada do próprio chifre dele.","type":"weapon","slot":"weapon","rarity":"legendary","weight":9,"stack_max":1,"buy_price":0,"sell_price":80000,"attack":112,"weapon_class":"melee","skill":"taijutsu","required_level":78,"bonuses":{"crit_chance":0.1,"skill_taijutsu":8,"hp":120,"element_damage_raiton":0.15},"sprite":"item_oni_fang_blade"}
]
